{
  "id": "ihsan",
  "tradition": "islam",
  "names": {
    "primary": "Ihsan",
    "original": "إحسان",
    "transliteration": "iḥsān",
    "aliases": ["Spiritual excellence", "excellence", "doing what is beautiful", "to do good", "beautiful-doing"]
  },
  "category": "spirituality",
  "summary": "Ihsan, 'spiritual excellence' or 'doing what is beautiful', is defined in the hadith of Gabriel as worshipping God 'as though you see Him, and if you do not see Him, He nonetheless sees you'. In that report it names the interior, perfecting dimension of religion alongside outward submission (islam) and belief (iman), and Sufi authors identify it with the goal of their path.",
  "description": "The term ihsan derives from a root meaning to do what is good or beautiful. Its classic theological reference point is the hadith of Gabriel, a widely transmitted report in which the angel Gabriel questions the Prophet in turn about islam, iman and ihsan. There islam is answered by the outward acts of submission (the testimony of faith, prayer, almsgiving, fasting and pilgrimage), iman by inner belief in God, His angels, books, messengers, the Last Day and the divine decree, and ihsan by the Prophet's words, 'that you worship God as though you see Him, and if you do not see Him, He nonetheless sees you'. On the reading of this hadith common in the tradition, the three terms mark ascending dimensions of religion: practice, faith, and the excellence or beauty that perfects them, an inward disposition of God-consciousness informing outward act and inner belief.\n\nSufi authors take ihsan, so defined, as the very object of their path, glossing it as the perfecting interior dimension of religion cultivated through self-purification, the remembrance of God (dhikr) and the discipline of the heart. Contemporary scholars such as Sachiko Murata and William Chittick have used the islam-iman-ihsan schema of the hadith of Gabriel as an organizing framework for the whole of the Islamic religious life, with ihsan naming its spiritual or contemplative dimension. This entry reports the definition and the tradition's use of the term descriptively.",
  "editorial_notes": "Scope: ihsan as a theological and spiritual category defined by the hadith of Gabriel and taken up by Sufism as the goal of the path. Reported descriptively, not in a devotional register, per neutrality principle #4. The islam-iman-ihsan triad is presented as the reading of the hadith common in the tradition, attributed rather than asserted as the single correct interpretation (principles #1 and #2). Category set to 'spirituality'. Relations: related_to iman (both are defined together in the same hadith; iman is an existing entry), part_of sufism (Sufi authors take ihsan as the goal of the path), related_to dhikr (a sibling entry in this batch, the practice through which ihsan is cultivated). Sources triangulate three lenses per neutrality principle #8: (a) the primary text, the hadith of Gabriel as transmitted in the canonical collections of al-Bukhari and Muslim; (b) a contemporary Muslim scholarly work built around this very hadith and its islam/iman/ihsan structure (Murata and Chittick, The Vision of Islam, web-verified); (c) a modern academic history of Sufism (Karamustafa) for the tradition's adoption of ihsan as the goal of the path. Verified tier (2026-07-19): the load-bearing claims of this entry are the definitions carried by the hadith of Gabriel, and these were confirmed against the primary text actually read. Two recensions were read in English translation: Sahih al-Bukhari no. 50 (via hadithunlocked.com/bukhari:50) and Sahih Muslim no. 8 (via hadithunlocked.com/muslim:8a). Confirmed in both: Gabriel questions the Prophet about islam, iman and ihsan in turn; islam is answered by the outward acts (Muslim gives the full five: the two-part testimony, prayer, zakat, the fast of Ramadan, and the pilgrimage for the able); iman is answered, in the fuller Muslim recension, by faith in Allah, His angels, His Books, His Messengers, the Last Day, and the divine decree of good and evil (Bukhari's shorter list gives Allah, His angels, the meeting with Him, His Messengers, and the Resurrection); and ihsan is defined exactly as 'that you worship Allah as if you see Him, for though you do not see Him, He verily sees you' (Muslim) / 'to worship Allah as if you see Him, and if you are unable, then He is watching you' (Bukhari). The report closes with 'That was Gabriel who came to teach you your religion.' The hadith source is raised to high confidence on this reading. The two secondary sources remain medium and are so marked: Murata and Chittick, The Vision of Islam, and Karamustafa, Sufism: The Formative Period, were NOT read line-by-line here (The Vision of Islam is borrow-only on archive.org and its full text was not served; Karamustafa was consulted only bibliographically). The claims resting on them (that Murata and Chittick structure their book on the islam/iman/ihsan schema, and that formative Sufism took up ihsan as the goal of the path) are therefore attributed but not independently confirmed against those texts. They are supporting, not load-bearing: the entry's core definitional claims rest on the primary hadith, which was read. Peer-review fix (v0.1.0 promotion pass, 2026-07-19): the Karamustafa source url previously pointed to a Journal of Qur'anic Studies review of the book (on euppublishing.com) rather than to the book itself; it has been replaced with the book's own JSTOR record. Citation text was already correct and is unchanged.",
  "relations": [
    { "type": "related_to", "target": "iman", "note": "Ihsan is defined alongside islam and iman in the hadith of Gabriel, as the perfecting interior dimension beyond outward practice and inner belief." },
    { "type": "part_of", "target": "sufism", "note": "Sufi authors take ihsan, 'to worship God as though you see Him', as the very goal of the spiritual path." },
    { "type": "related_to", "target": "dhikr", "note": "The abiding God-consciousness that ihsan names is cultivated in Sufism above all through dhikr, the remembrance of God." }
  ],
  "historical_period": {
    "start": 610,
    "note": "Rooted in the prophetic hadith of Gabriel (early 7th century CE); taken up as the goal of the path in the formative Sufism of the 3rd/9th century and after."
  },
  "sources": [
    {
      "citation": "The Hadith of Gabriel (Hadith Jibril), transmitted in Sahih al-Bukhari, Kitab al-Iman (no. 50), and Sahih Muslim, Kitab al-Iman (no. 8). Classical primary source: the Prophet defines islam, iman and ihsan, glossing ihsan as 'that you worship God as though you see Him, and if you do not see Him, He nonetheless sees you'. Both recensions read in English translation and confirmed.",
      "license": "Public-domain classical text; cited for reference.",
      "accessed": "2026-07-19",
      "confidence": "high"
    },
    {
      "citation": "Murata, Sachiko, and William C. Chittick. The Vision of Islam. New York: Paragon House, 1994. A contemporary Muslim scholarly work structured around the hadith of Gabriel, treating islam, iman and ihsan as the three dimensions of the religion, with ihsan as its spiritual dimension. Relevant passages not read line-by-line.",
      "url": "https://archive.org/details/visionofislam0000mura",
      "license": "Proprietary; cited for reference.",
      "accessed": "2026-07-19",
      "confidence": "medium"
    },
    {
      "citation": "Karamustafa, Ahmet T. Sufism: The Formative Period. The New Edinburgh Islamic Surveys. Edinburgh: Edinburgh University Press, 2007. On the interior perfecting of religion (ihsan) as an orienting aim of the Sufi tradition. Relevant passages not read line-by-line.",
      "url": "https://www.jstor.org/stable/10.3366/j.ctt1s4744s",
      "license": "Proprietary, cited for reference; text not reproduced.",
      "accessed": "2026-07-19",
      "confidence": "medium"
    }
  ],
  "status": "verified",
  "schema_version": "0.1.0",
  "created": "2026-07-19",
  "updated": "2026-07-19"
}
