{
  "id": "dhikr",
  "tradition": "islam",
  "names": {
    "primary": "Dhikr",
    "original": "ذِكْر",
    "transliteration": "dhikr",
    "aliases": ["Remembrance of God", "Invocation", "Zikr", "recollection", "the remembrance"]
  },
  "category": "practice",
  "summary": "Dhikr is the remembrance and invocation of God, the repeated mention of His names or of set formulae, described by Sufi authors as the central practice of the spiritual path. It is grounded in Qur'anic injunctions to remember God, and is performed both individually and communally, the latter often in the assemblies of the Sufi orders.",
  "description": "Dhikr, from the Arabic root meaning to remember, mention or recollect, denotes the remembrance and invocation of God through the repeated utterance of His names, of the testimony of faith (la ilaha illa Allah), or of other set formulae. Sufi authors ground the practice in the Qur'an, which repeatedly enjoins the believers to remember God much and speaks of the remembrance of God as bringing tranquillity to hearts, and in the example (sunna) of the Prophet. In the vocabulary of Sufism (tasawwuf), dhikr is treated as the central discipline of the path: a means of purifying the heart, of maintaining the consciousness of God's presence, and of drawing the invoker toward the Named through the Name.\n\nThe manuals and the orders distinguish outward and inward forms, dhikr of the tongue and dhikr of the heart, and individual from communal performance. Individual dhikr is often practised under the guidance of a master (shaykh) following initiation, sometimes with prescribed formulae and numbers. Communal dhikr, performed in the gatherings of the tariqas, may be vocal and rhythmic and is in some orders joined with spiritual audition (sama'), movement or breath control; the specific forms vary widely between orders such as the Qadiriyya, Shadhiliyya, Naqshbandiyya, Chishtiyya and Mevleviyya. Some of these practices, and the assemblies around them, have been objects of criticism from other Muslim scholars, while Sufi authors defend them as rooted in the Qur'an and the prophetic example. This entry reports the practice and its rationale as given by the tradition and does not adjudicate such disputes.",
  "editorial_notes": "Scope: dhikr as the central devotional practice of Sufism, its Qur'anic grounding, and its individual and communal forms. Reported descriptively, not in a devotional register, per neutrality principle #4; the Qur'anic grounding and the prophetic example are given as the tradition's own basis for the practice, and where specific communal forms have drawn criticism this is noted and not adjudicated (principles #2 and #7). Category set to 'practice' (this is a practice rather than a doctrine). Relations: part_of sufism, related_to tawhid (the formula of dhikr is often the testimony of God's oneness), related_to ihsan (dhikr cultivates the God-consciousness that ihsan names; ihsan is a sibling entry in this batch). Sources triangulate three lenses per neutrality principle #8: (a) a modern Western academic history (Knysh, Sufism: A New History); (b) a classical primary manual, al-Qushayri's Risala, which treats dhikr among the path's practices, and al-Ghazali's Ihya' on the disciplines of the heart; (c) a contemporary Muslim scholar (Nasr, Garden of Truth), whose exposition treats dhikr as the central reality of Sufi life (web-verified). Confidence medium: works verified to exist and be on-topic, relevant passages not read line-by-line.",
  "relations": [
    { "type": "part_of", "target": "sufism", "note": "The central devotional discipline of the Sufi path (tasawwuf), individual and communal." },
    { "type": "related_to", "target": "tawhid", "note": "The formula most characteristic of dhikr is the testimony of God's oneness (la ilaha illa Allah), so the practice is bound to tawhid." },
    { "type": "related_to", "target": "ihsan", "note": "Dhikr is described as cultivating the abiding consciousness of God's presence that the term ihsan names." }
  ],
  "historical_period": {
    "start": 610,
    "note": "Grounded in Qur'anic injunctions to remember God (from 610 CE) and the prophetic example; elaborated as the central Sufi discipline from the formative period and structured into the communal liturgies of the tariqa orders from roughly the 6th-7th/12th-13th centuries."
  },
  "sources": [
    {
      "citation": "Knysh, Alexander. Sufism: A New History of Islamic Mysticism. Princeton: Princeton University Press, 2017. On dhikr as a defining Sufi practice and its individual and communal forms across the orders.",
      "url": "https://press.princeton.edu/books/hardcover/9780691139098/sufism",
      "license": "Proprietary, cited for reference; not reproduced here.",
      "accessed": "2026-07-19",
      "confidence": "medium"
    },
    {
      "citation": "al-Qushayri, Abu 'l-Qasim. al-Risala al-Qushayriyya fi 'ilm al-tasawwuf (5th/11th c.), trans. Alexander D. Knysh as Al-Qushayri's Epistle on Sufism. Reading: Garnet Publishing, 2007. Classical Sufi manual treating dhikr among the practices and states of the path. See also al-Ghazali, Ihya' 'Ulum al-Din, on the disciplines of the heart. Relevant passages not read line-by-line.",
      "url": "https://academic.oup.com/jis/article-abstract/23/3/372/714370",
      "license": "Primary source in scholarly translation; cited for reference.",
      "accessed": "2026-07-19",
      "confidence": "medium"
    },
    {
      "citation": "Nasr, Seyyed Hossein. The Garden of Truth: The Vision and Promise of Sufism, Islam's Mystical Tradition. New York: HarperOne, 2007. A contemporary Muslim scholar's exposition treating dhikr (invocation, remembrance) as the central reality of the life of the Sufis and grounding it in the Qur'anic names of God. Relevant passages not read line-by-line.",
      "url": "https://archive.org/details/gardenoftruthvis0000nasr",
      "license": "Proprietary; cited for reference.",
      "accessed": "2026-07-19",
      "confidence": "medium"
    }
  ],
  "status": "draft",
  "schema_version": "0.1.0",
  "created": "2026-07-19",
  "updated": "2026-07-19"
}
